"X","country","description","designation","points","price","province","region_1","region_2","taster_name","taster_twitter_handle","title","variety","winery"
96835,"US","Confected and slightly artificial, there's a thick aroma of canned pineapple syrup and rose petals on the nose, which feels a bit off balance from the much less-intense palate. Bright canned fruit lingers on the finish.","Lost Draw Vineyards",85,19,"Texas","Texas High Plains","","Alexander Peartree","","Los Pinos Ranch 2015 Lost Draw Vineyards Vermentino (Texas High Plains)","Vermentino","Los Pinos Ranch"
96844,"US","Mild tones of pollen, lemon, vanilla cream and sawdust carry the aromas and flavors. The palate is round and juicy, with appropriate balance of weight and acidity, yet the finish comes short. Perfectly enjoyable as an apéritif.","Reserve",85,22,"Texas","Texas High Plains","","Alexander Peartree","","Becker 2014 Reserve Viognier (Texas High Plains)","Viognier","Becker"
97097,"US","This blend of 80% Merlot and 20% Cabernet Franc displays aromas of cherry, blueberry and bramble berries, backed by aromas of vanilla, nutmeg and cinnamon. The palate is medium bodied with supportive tannins and shows flavors of red berries and baking spices. Leather and cedar carry to the finish joined by a swath of acidity.","Chevaux Noir",88,40,"Texas","Texas High Plains","","Fiona Adams","@bkfiona","Becker 2014 Chevaux Noir Cabernet Franc-Merlot (Texas High Plains)","Cabernet Franc-Merlot","Becker"
99198,"US","Aromas of cassis, dried cranberry and black cherry are backed by tobacco and a kick of licorice. The palate is ripe in raspberry, blueberry and black cherry, showing whispers of leather and white pepper. The tannins add balance, mellowing some of the ripeness. Currant and vanilla show on the medium-length finish.","Private Reserve Double Barrel",88,30,"Texas","Texas High Plains","","Fiona Adams","@bkfiona","Messina Hof 2015 Private Reserve Double Barrel Malbec (Texas High Plains)","Malbec","Messina Hof"
99909,"US","Restrained on the nose, this is slow to reveal notes of spice cake, clove liqueur and waxy raisin. The tannins lend the palate grip, but it finishes short on flavor, with the structural elements most prominent.","Private Reserve Double Barrel Bell Brothers-Merrill's Vineyard",82,22,"Texas","Texas","","","","Messina Hof 2009 Private Reserve Double Barrel Bell Brothers-Merrill's Vineyard Zinfandel (Texas)","Zinfandel","Messina Hof"
99920,"US","Classic late-harvest Riesling with opening notes of peach and stone fruit. The sweet but racy palate is home to nectarine and white flowers shot through with a streak of acidity. Not overly generous but a good reflection of the category. Great for after-dinner sipping. May improve with a few years' age but drinking well now.","Angel Late Harvest",84,20,"Texas","Texas","","","","Messina Hof 2008 Angel Late Harvest Riesling (Texas)","Riesling","Messina Hof"
102674,"US","Craisin and geranium aromas mark the nose of this Texas Syrah. The medium-bodied palate brings more floral tones, soapy in nature, with soft tannins giving little support.","",83,24,"Texas","Texoma","","Alexander Peartree","","Arché 2012 Syrah (Texoma)","Syrah","Arché"
103505,"US","Red cherry and currant mix with sweet sawdust and anise-spiced gum on the nose. Medium-bodied, with a plush feel, juicy red fruit flavors pervade on the palate. Light tannins make this an easy sipper—enjoy alone or with lighter proteins.","Reserve",86,32,"Texas","Texas","","Alexander Peartree","","Brennan 2013 Reserve Tempranillo (Texas)","Tempranillo","Brennan"
103516,"US","This bottling of an American hybrid grape demonstrates a floral side of the variety, with potpourri aromas riding over lychee and grapefruit. Green apple-skin flavors mark the light-bodied palate while sprtizy acidity keeps everything energized.","Dry",86,19,"Texas","Texas","","Alexander Peartree","","Haak 2013 Dry Blanc du Bois (Texas)","Blanc du Bois","Haak"
106001,"US","Serious and solid, this Cab Franc delivers the goods with a complex nose of vanilla, coconut and orange clove pomanders layered over coffee and bittersweet chocolate. There's nice fruit in the mouth, with plum and blackberry shot through with notes of cinnamon. Medium, oaky finish. Serve with roast beef. Best 2011–2012.","Double Barrel",87,14,"Texas","Texas","","","","Messina Hof 2007 Double Barrel Cabernet Franc (Texas)","Cabernet Franc","Messina Hof"
107519,"US","Aromas and flavors of blackberry, pomegranate, leather and cedar are warmed by baking spice and bitter chocolate on the palate. The tannins are firm and lend plenty of structure. Cedar and tobacco prevail on the finish, with a touch of warmth.","Reserve",86,25,"Texas","Texas","","Fiona Adams","@bkfiona","Becker 2012 Reserve Cabernet Sauvignon (Texas)","Cabernet Sauvignon","Becker"
108138,"US","Deep and dark smelling, this has aromas of Mission fig, black fruit compote and spiced pastry. It's a heavyweight effort with a dense texture, but the acidity saves it from feeling ponderous. An overripe flavor of sun-dried fruit dominates the flavor profile, concluding with a touch of Bourbon barrel on the medium-long finish.","Private Reserve Double Barrel Cerro Santo Vineyard",85,22,"Texas","Texas","","","","Messina Hof 2010 Private Reserve Double Barrel Cerro Santo Vineyard Primitivo (Texas)","Primitivo","Messina Hof"
108180,"US","A veneer of new wood overlays the aromas of smoke, spiced blueberry, blackberry and olive. Well-proportioned acids and tannins give shape to this medium- to full-bodied effort, which concludes with a seemingly long, clingy finish.","Private Reserve Double Barrel Cedar Crest Vineyard",86,22,"Texas","Texas","","","","Messina Hof 2009 Private Reserve Double Barrel Cedar Crest Vineyard Cabernet Franc (Texas)","Cabernet Franc","Messina Hof"
108853,"US","Pollen, candle wax, citrus cream and blanched almonds mark the nose of this single variety white. The rich, broad palate carries notes of charred pineapple and toasted meringue, balanced by a lively river of citrus. This is a perfect white to enjoy when there's a slight chill in the air.","",87,24,"Texas","Texas High Plains","","Alexander Peartree","","Arché 2012 Roussanne (Texas High Plains)","Roussanne","Arché"
108961,"US","A mix of dark fruit and warm spice carries the medium-bodied palate. Soft tannins give an easy nature to this wine and the vanilla-cookie finish doesn't hurt either.","Bingham Family Vineyard",85,26,"Texas","Texas High Plains","","Alexander Peartree","","Lost Oak 2014 Bingham Family Vineyard Tempranillo (Texas High Plains)","Tempranillo","Lost Oak"
108963,"US","There's a solid grip to this blend of 54% Aglianico, 21% Montepulciano, 14% Tempranillo and 11% Barbera. Bramble berries and earthy geraniums give this medium-bodied red some interest.","Stampede",85,20,"Texas","Texas High Plains","","Alexander Peartree","","THP 2013 Stampede Red (Texas High Plains)","Red Blend","THP"
108972,"US","Succinct and to-the-point, this Viognier is bight in pineapple, citron and peach on the nose and palate. There's a decent weight and texture, however the flavors don't carry too long. Drink now.","Reserve Newburg Vineyard",85,25,"Texas","Texas","","Alexander Peartree","","Brennan 2015 Reserve Newburg Vineyard Viognier (Texas)","Viognier","Brennan"
110078,"US","Lemon spray and savory cheese-rind notes mark the nose and palate. Having seen some time in oak, this boasts a round body and mild acidity.","Estate Reserve",84,19,"Texas","Texas","","Alexander Peartree","","Haak 2013 Estate Reserve Blanc du Bois (Texas)","Blanc du Bois","Haak"
110089,"US","Spiced red berries meet earthy floral tones on the nose. Round in feel, the palate carries red currant and strawberry tones, flecked by warm spice flavors. Burnt brown sugar signals the close.","Oswald Vineyard",84,30,"Texas","Texas","","Alexander Peartree","","Duchman Family 2012 Oswald Vineyard Aglianico (Texas)","Aglianico","Duchman Family"
110090,"US","Peach, yellow plum and underripe banana tones mark the nose. Banana makes an appearance again—in candied form—on the medium-bodied, almost oily palate. Sharp lemon citrus tones race on the finish.","Bingham Family Vineyard",84,20,"Texas","Texas","","Alexander Peartree","","Duchman Family 2014 Bingham Family Vineyard Vermentino (Texas)","Vermentino","Duchman Family"
113333,"US","Aromas of raspberry and green peppercorn carry the nose. The palate is green, with underripe cranberry and wild blackberry accompanied by leather and white pepper. Underripe tannins are course throughout and dominate the finish with flavors of blackberry and cedar.","Cellar Reserve",82,20,"Texas","Texas","","Fiona Adams","@bkfiona","Llano Estacado 2014 Cellar Reserve Cabernet Sauvignon (Texas)","Cabernet Sauvignon","Llano Estacado"
121278,"US","Cocoa powder, anise and cowhide aromas lead, with hints of fresh currants. Juicy cherry and ripe raspberry are appealing on the palate, paving the way for sweet baking spices and vanilla. The tannins are disjointed from this soft-structured, fruit-forward offering. The lack of acidity is most apparent on the finish, which shows overripe cherry and hints of clove.","",86,25,"Texas","Texas High Plains","","Fiona Adams","@bkfiona","Haak 2014 Malbec (Texas High Plains)","Malbec","Haak"
124366,"US","Tempranillo-dominant, there's also Grenache, Mourvèdre, Carignan and Syrah in the mix. Strawberry and red cherry pervade on the nose and palate, with sweet baking spice and pepper adding depth. Medium in weight, there's a decent tannic grip to offer support on the midpalate, transitioning to a soft, sandy exit.","La Herencia",88,13,"Texas","Texas","","Alexander Peartree","","McPherson 2014 La Herencia Red (Texas)","Red Blend","McPherson"
127723,"US","Aromas of black fruit, cinnamon and tobacco are congenial on the nose. The palate is velvety, with flavors of blackberry and cedar backed by nutmeg, clove and ashy tannins. Currant and cedar notes turn spicy on the finish. Pair with game meats.","",88,25,"Texas","Texas High Plains","","Fiona Adams","@bkfiona","Haak 2014 Cabernet Sauvignon (Texas High Plains)","Cabernet Sauvignon","Haak"
